{
  "$schema": "https://json-schema.org/draft/2020-12/schema",
  "$id": "audit_task.schema.json",
  "title": "Audit Task",
  "type": "object",
  "required": [
    "task_id",
    "unit_id",
    "pass_id",
    "lens",
    "file_paths",
    "rationale"
  ],
  "properties": {
    "task_id": { "type": "string" },
    "unit_id": { "type": "string" },
    "pass_id": { "type": "string" },
    "lens": { "$ref": "lens.schema.json" },
    "file_paths": {
      "type": "array",
      "minItems": 1,
      "items": { "type": "string" }
    },
    "file_line_counts": {
      "type": "object",
      "additionalProperties": {
        "type": "integer",
        "minimum": 0
      }
    },
    "line_ranges": {
      "type": "array",
      "items": {
        "type": "object",
        "required": ["path", "start", "end"],
        "properties": {
          "path": { "type": "string" },
          "start": { "type": "integer", "minimum": 1 },
          "end": { "type": "integer", "minimum": 1 }
        },
        "additionalProperties": false
      }
    },
    "inputs": {
      "type": "object",
      "properties": {
        "unit_manifest_ref": { "type": "string" },
        "graph_bundle_ref": { "type": "string" },
        "mechanical_results_ref": { "type": "string" },
        "risk_register_ref": { "type": "string" }
      },
      "additionalProperties": { "type": "string" }
    },
    "rationale": { "type": "string" },
    "priority": {
      "type": "string",
      "enum": ["high", "medium", "low"]
    },
    "token_estimate": {
      "type": "number",
      "minimum": 0,
      "description": "Frozen provider-neutral content-token estimate for this task's files; authoritative input to just-in-time dispatch packetization."
    },
    "risk_estimate": {
      "type": "number",
      "minimum": 0,
      "maximum": 1,
      "description": "Frozen provider-neutral audit-risk score in [0,1]; drives just-in-time risk-mass packetization and model-tier routing."
    },
    "tags": {
      "type": "array",
      "minItems": 1,
      "items": { "type": "string" }
    },
    "status": {
      "type": "string",
      "enum": ["pending", "complete"]
    },
    "completed_at": {
      "type": "string"
    },
    "completion_reason": {
      "type": "string"
    }
  },
  "additionalProperties": false
}
